637,Hamamelis Verginica,,,,,,,,,,,,,,,,,,,,,,,,,,,,,,,,,,,,,,,,,,,,,,,,,,,,,,,,,,,,,,,,,,,,,,neurolgia pain internal saphenous back to foot nerve,,,,,,,,,,,,,,,,,,very sore muscles and joints,,vericose veins,,,,,,,,tired feeling in arm and legs,,,,,,,,,chilliness back and hips extend eown legs,,,,,,,,,,,,,,,,,,,,,,,,,,,,,,,,,,,,,
638,Hedeoma,,,,,,,,,,,,,,,,,,,,,,,,,,,,,pain coldness and paretic condition,,,,,,,,,,,,,,,,,,,,,,,,,,,,,,,,,,,,,,,,,,,,,,,,,,,,,,,,,,,,,,,,,,,,,,,,,,,,pain in thumb joint,,,,,,,,tendo achilles painful asif sprained walking painful,,,,,,,,,,twitching jerking soreness,,,,,,,,,,,,,,,,,,,,,
639,Helleborus,,,,,,,,,,,,,,,,,,,,,,,,,,,,,,,,,,,,,,,,,,,,,,,,,,,,,,,,,,,,,,,,,,,,,,,,,,,,,,,,,,,,,,,limbs heavy painful stretching ,,,,,,,,,,,automatic motion one arm and leg,,,,,thumb drawn into palm,,,,,,,,,,,,,,,vesicular eruption between fingers and toes,,,,,,,,,,,,,,,,,,,,,,,,,,
640,Heloderma,,,,,,,,,,,,,,,,,,,,,,,,,,,,,,,,,,,,,,,,,,,,,,,,,,,,,,,,,,,,,,,,,,,,,,,,,,,,,,,,,,,,,,,,stretching relives better pains muscles limbs,,,,,,,,,,,,,,,,cyanosis hands coldness,,,,,,,,,,,,,feet cold as ice or burn,,,,staggering cocks gait while walk lift feet higher than usual down heel hard,,sensation asif walking on sponge feet were swollen,,,,,,,,,,,,,,,,,,,,,
641,Helonias,,,,,,,,,,,,,,,,,,,,,,,,,,,,,,,,,,,,,,,,,,,,,,,,,,,,,,,,,,,,,,,,,,,,,,,,,,,,,,,,,,,,,,,,,,,,,,,,,,,,,,,,,,,,,,,,,,,,,feet feel numb when sitting,,,,,,sensation asif cool wind streamed up on calves ,,,,,,,,,,,,,,,,,,,,,
642,Hepar SulphurisCalcareum,,,,,,,,,,,,,,,,,,,,,,,,,,,,,,,,,,,,,,,,,,,,,,,,,,,,,,,,,,,,,,,,,,,,,,,,,,,,,,,,,,,,,,,,,,,,,,,,,,,,,,,,,finger joint swelling,,,,,,,,,,,,,great toe nail painfull on slight pressure,,tendency easy dislocation,,,,,,,,,,,,,,,,,,,,,,,,
643,Hippomanes,,,,,,,,,,,,,,,,,,,,,,,,,,,,,,,,,,,,,,,,,,,,,,,,,,,,,,,,,,,,,,,,,,,,,,,,,,,,,,,,,,,,,,,,,,,,,,,,,,,,,violent pain wrist paralysis,,,great weakness hands fingers,,,,,,,,,,,,,,,,weakness joints feet knee soles,much weakness after growing too fast,,sprained sensation in wrist,,chorea,,,,,,,,,,,,,,,,,,,
644,Hippuric Acid,,,,,,,,,,,,,,,,,,,,,,,,,,,,,,,,,,,,,,,,,,,,,,,,,,,,,,,,,,,,,,,,,,,,,,,,,,,,,,,,,,,,,,,,,,,,,,pain shoulders extermities sore swolling joints,,,,,,,,,,,,,backache extend down hips,,,,pain middle thigh posterirly back shooting down right leg,,,,,,,,,,,,tired grating sensation in joints,,,,,,,,,,,,,,,,,,,,,
645,Hydrastis,,,,,,,,,,,,,,,,,,,,,,,,,,,,,,,,,,,,,,,,,,,,,,,,,,,,,,,,,,,,,,,,,,,,,,,,,,,,,,,,,,,,,,,,,,,,,,,,,,must use arms raising himself from seat,,,,,,,,,dull heavy dragging pain and stiffness perticularly across lumbar back region,,,,,,,,,,,,,,,,,,,,,,,,,,,,,,,,,,,,,
646,Hyoscymus,,,,,,,,,,,,,,,,,,,,,,,,,,,,,,,,,,,,,,,,,,,,,,,,,,,,,,,,,,,,,,,,,,,,,,,,,,,,,,,,,,,,,,,,,,,,,,,,,,,,,,,,plays with hands reaches out of things,picking bed clothes,,,,,,,,,cramps calves and toes,,,,,,,,,,,,,spasms and convulsions,child sobs cries without waking,,epileptic attacks ending in deep sleep,,,,,,,,,,,,,,
647,Hypericum,,,,,,,,,,,,,,,,,,,,,,,,,,,,,,,,,,,,,,,,tetanus,,,,,,,,,,,,,,,,,,,,,,,,,,,,,,neuritis tingling burning tramatric neurolgia,,,,,,,,,,,,,,,,,,,,,,,numbness flossy skin,darting pain shoulders,,,lancinating pain upper limb and lower limbs,,,pressure along ulnar side,,,,crawling hands and feet,pain toes and fingers esp tips,,,,,,,,,,,,,,,hysterical  feel bruised joints,,,,,,,,,,,,,,,,,,,,,,,,
648,Iberis,,,,,,,,,,,,,,,,,,,,,,,,,,,,,,,,,,,,,,,,,,,,,,,,,,,,,,,,,,,,,,,,,,,,,,,,,,,,,,,,,,,,,,,,,,,,,,,,,,,,,,,numbness tingling in left hand and arm,,,,,,,,,,,,,,,,,,,whole body sore lame trembling,,,,,,,,,,,,,,,,,,,,,,
649,Ignatia,,,,,,,,,,,,,,,,,,,,,,,,,,,,,,,,,,,,,,,,,,,,,,,,,,,,,,,,,,,,,,,,,,,,,,,,,,,,,,,,,,,,,,,jerking in limbs,,,,,,,,,,,,,,,,,,,,,,,,,pain tendoachillis and calf,,,,,,ulcerative pain in soles,,,,,,,,,,,,,,,,,,,,,,,,,,
650,Indigo,,,,,,,,,,,,,,,,,,,,,,,,,,,,,,,,,,,,,,,,,,,,,,,,,,,,,,,,,,,,,,,,,,,,,,,,,,,,,,,,,,,,,,,pain in limbs worse after every meal,,,,sciatica,,,,,,,,,,,,,,,,,,,pain from middle thighs to knee,boring pain knee joint better walking,,,,,,,,,,,,,,,,,,,,,,,,,,,,,,,,,
651,Inidium,,,,,,,,,,,,,,,,,,,,,,,,,,,,,,,,,,,,,,,,,,,,,,,,,,,,,,,,,,,,,,,,,,,,,,,,,,,,,,,,,,,,,,,,,,,,,,stiff neck and shoulders,,,,pain esp left arm,,,,,,,,,,,,,,legs restless weary tiredness,,,,,toes itch,,,,,,,,,,,,,,,,,,,,,,,,,,,
652,Indol,,,,,,,,,,,,,,,,,,,,,,,,,,,,,,,,,,,,,,,,,,,,,,,,,,,,,,,,,,,,,,,,,,,,,,,,,,,,,,,,,,,,,,,,,,,,,,,,,,,,,,,,,,,very tired lower limbs,,,,knee joint sore,,,,,,feet burn,,,,,,,,,,,,,,,,,,,,,,,,,,,
653,Inula,,,,,,,,,,,,,,,,,,,,,,,,,,,,,,,,,,,,,,,,,,,,,,,,,,,,,,,,,,,,,,,,,,,,,,,,,,,,,,,,,,,,,,,,,,, ,,,pain right shoulder and wrist,,,,,,,,tearing in left palm,,unable to double fingers,,,pain in lower limbs feet and ankles,,,,,,,,,,,,,,,,,,,,,,,,,,,,,,,,,,,,,
654,Iodoformum,,,,,,,,,,,,,,,,,,,,,,,,,,,,,,,,,,,,,,,,,,,,,,,,,,,,,,,,,,,,,,,,,,,,,,,,,,,,,,,,,,,,,,,,,,,,,,,,,,,,,,,,,,,,,,,weakness in knees going upstairs,legs weak,,,,,,,,,,,,can not stand and walk with eyes closed,,,,,,,,,,,,,,,,,,,,
655,Iodum,,,,,,,,,,,,,,,,,,,,,,,,,,,,,,,,,,,,pain in bones at night,,,,white swelling gonorrhoeal rheumatism,,,,,,,,,,,,,,,,,,,,,,,,,pulsation in large artery trunk,,,,,,,,,,,,,,,,,,,,,,,,,,,,,,,,rheumatismof nape and upper extermities,,,,,,cold hands and feet,,,,,,,,,,,,,acrid sweat feet,,,joints inflamed and painful,,,constrictive sensation,,,night pains in joints,,,,,,,,,,,,,,,,,,,
656,Ipecacuanha,,,,,,,,,,,,,,,,,,,,,,,,,,,,,,,,,,,,,,,,,,,,,,,,,,,,,,,,,,,,,,,,,body streched stiff ,,,,,,,,,,,,,,,,,,,,,,,,,,,,,,,,,followed spasmodic jerking arms towards each other,,,,,,,,,,,,,,,,,,,,,,,,,,,,,,,,,,,,,,,,,,,,,,
657,Iridium,,,,,,,,,,,,,weakness in kidney region,,,,,,,,,,,,,,,,,,,,,,pressing in groin and thighs,,,,,,,,,,,,,,,,,,,,,,,,,,,,,,,,,,,,,,,,,,,,,,,,,,,,,,,,,spinal paresis esp aged and other disease,,,,,,,,,,,,,,,,,,tension both thighs esp left,,,,,,,,,,,,dislocated feeling in left hip joint,,,dull pain towards left gluteal region,,,,,,,,,,,,,,,,,,,
658,Iris versicolor,,,,,,,,,,,,,,,,,,,,,,,,,,,,,,,,,,,,,,,,gonrrhoeal rheumatism,,,,,,,,,,,,,,,,,,,,,,,,,,,,,,,,,,,,,,,,,,,,,,,,,,,scaitica asif left hip joint wrenched,,,,,,,,,,,,,,,,,,,,,pain extend to popliteal space,,,,,,,,,,,,,shifting pains,,,,,,,,,,,,,,,,,,,
659,Jacaranda,,,,,,,,,,,,,,,,,,,,,,,,,,,,,,,,,,,,,,,,gonorrhoeal rheumatism,,,,,,,,,,,,,,,,,,,,,,,,,,,,,,,,,,,,,,,,,,,,,,,,morning soreness and stffness muscles,,,,,,,,,,,,,,,,itching pimples on hands,,,weakness lumbar region,,,,rheumatic pain in right knee,,,,,,,gonorrhoeal and syphilitic arthritis,,,,,,,,,,,,,,,,,,,,,,,,,,
660,Jalapa,,,,,,,,,,,,,,,,,,,,,,,,,,,,,,,,,,,,,,,,,,,,,,,,,,,,,,,,,,,,,,,,,,,,,,,,,,,,,,,,,,,,,,,,,,,,,,,,,,aching arms and legs,,,,,,,smarting root nail,,,,,,,,,,,,pain great toe,burning soles,,,,,,,,,,,,,,,,,,,,,,,,,,
661,jatropha,,,,,,,,,,,,,,,,,,,,,,,,,,,,,,,,,,,,,,,,,,,,,,,,,,,,,,,,,,,,,,,,,,,,,,,,,,,,,,,,,,,,,,,,cramps muscle esp calves legs feet,,,,,,,,,,,,,,,,,,,,,,,,,,pain ankle feet toes ,heel sensitive,,,,,,,coldness whole body,,,,,,,,,,,,,,,,,,,,,,
662,KaliBichromicum,,,,,,,,,,,,,,,,,,,,,,,,,,,,,,,,,,,,,,,,syphilitic rheumatism,,,,,,,,,,,,,,,,,,,,,,,,,pains fly rapidly from one place to another,,,,,,,,,,,,,,,,,,,,,,,,wandering pain along bones worse cold feel sore bruised,,,,,,,,,,,,,,,,,,,left sided sciatica better movement motion,,,,tendoachilles swelling painful,,,soreness heel s when walking,,,,pain swelling stiffness crackling of all joints,,,,,,pains in small spots,,,,,,,,,,,,,,,,,,,
663,KaliBromatum,,,,,,,,,,,,,,,,,,,,,,,,,,,,,,,,,,,,,,,,,,,,,,,,,,,,,,,,,,,,,,,,,,,,,,,,,,,,,,,,,,,,,,,,jerking twitching muscles,,,,,,,,,,,,,,,fidgety restless busy hands,twitching fingers,,,,,,,,,,,,,,,,,,,,,,,,,,,,,,,,,,,,,,,,
664,KaliCarbonicum,,,,,,,,,,,,,backs legs give out,,,,,,,,,,,,,,,,,,,,,,,,,,,,,,,,,,,,,,,,,,,,,,,,,,,,,,,,,,,,,,,,,,,,,,,,,,uneasiness heavyness tearing jerking in limbs sensitive pressure,,,,,,,,,,tearing in arms shoulders wrist,,,,lacerating wrist joint,,,tips of toes fingers painfull,,,,,pain from hip to knee,,white swelling pain in knee,,,,,,itching great toe with pain,soles very sensitive,,,,limbs go to sleep easily,,,tearing pain in limbs with swelling,,,paralysis old people and dropsicl affection,,,,,,,,,,,,,,,,
665,Kali Hydriodicum,,,,,,,,,,,,,pains small back and coccyx,,,,,,,,,,,,,,,,,,,,,,,,,,,,,,,,,,,,,,,,,,,,,,,,,,,,,,,,,,,,,,,,,,,,,,,formication lower extermities when sitting better lying down,,,,,sever bone pains,,,,,,,,,,,,,,,,,,,sciatica can not stay in bed worse night lying affected side,pain hip forcing limping,,rheumatism knees with effusion,perioesteum thickned esp tibia sensitive touch,,,,,,,contraction joints,,,,,,,,,rheumatism pain worse night damp weather,,,,,,,,,,,,,,,,
666,KaliMuriaticum,,,,,,,,,,,,,,,,,,,,,,,,,,,,,,,,,,,,,,,,,,,,,,,,,,,,,,,,,,,,,,,,,,,,,,,,,,,,,,,,,,,,,,,,,,,,,,,,,,,,,,,,handsget stiff while writing,,,,,,,,,,,,,,,rheumatic fever exudation and swelling around joints,,,,,rheumatc pain felt onlyduring movement increased by it,,,,rheumatic pain worse night warmth bed,,,,,,,,,,,,,,,,
667,KaliNitricum,,,,,,,,,,,,,,,,,,,,,,,,,,,,,,,,,,,,,,,,,,,,,,,,,,,,,,,,,,,,,,,,,,,,,,,,,,,,,,,,,,,,,,,,,,,,,,stitches between shoulder blades,,,,,,,,,hands and fingers seems swollen,,,,,,,,,,,,,,,,tearing sticking in shoulders and joints,,,,,,,,,,,,,,,,,,,,,,,,,
668,KaliPhosphoricum,,,,,,,,,,,,,,,,,,,,,,,,,,,,worse aggravtes exertion,,,,,,,,,,,,,,,,,,,,,,,,,,,,,,,,,,,,,,,,,,pain with depression subsequent exhaustion,,,,,,,,,,,,,,paralytic lameness back extermities,,,,,,,,,,,,,,,,,,,,,,,,,,,,,,,,,,,,,,,,,,,,,,,,,,,,,,,,,,,,
669,KaliSilicatum,,,,,,,,,,,,,,,,,,,,,,,,,,,,,,,,,,,,,,,,,,,,,,,,,,,,,,,,,,,,,,,,,weak weary,,,,,,,,,,,,,,,,,,,,,,stiffness over body and limbs,twitching muscles,,,,,,,,,,,,,,,,,,,,,,,,,,,,,,,,,,creaping crawling sensation over limbs,,,,,,,,,,,,,,,,,,,,,,
670,KaliSulphuricum,,,,,,,,,,,,,,,,,,,,,,,,,,,,worse warm room,,,,,,,,,,,,,,,,,,,,,,,,,,,,,,,,,,,,,,,,,,,,,,,,,,,,,,,,,,,pain nape back  limbs,,,,,,,,,,,,,,,,,,,,,,,,,,,,,,,,,,,,,,shifting wandering pains,,,,,,,,,,,,,,,,,,,
671,Kalmia Latiflora,,,,,,,,,,,,,,,,,,,,,,,,,,,,,,,,,,,,,,,,,,,,,,,,,,,,,,,,,,,,,,,,,weakness numbness pricking and coldness limbs,,,,,,,,,,,,,,,,,,,,,,pain affect large part limb or several joints pass through quickly,,,,,,,,,,,deltoid pain rheumatism esp right,,,,,,,,,,,pain from hip to knees and feet,,,,,,,,,,joints red swollen,,,tingling numbness left arm,,,pain along ulnar nerve index finger,,,,,,,,,,,,,,,,,,,
672,Kreosotum,,,,,,,,,,,,,,,,,,,,,,,,,,,,,,,,,,,,,,,,,,,,,,,,,,,,,,,,,,,,,,,,,,,,,,,,,,,,,,,,,,,,,,,,,,,,,,,scapulae sore,,,,,,,,,,,,,,boring pain in hip joints,,,,,,,,,, pain in joints hip and knee,,,,,,,,,,,,,,,,,,,,,,,,,
673,Laburnum,,,,,,,,,,,,,,,,,,,,,,,,,,,,,,,,,,,,,,,,,,,,,,,,,,,,,,,,,,,,,,,,,,,,,,,,,,,,,,,,,,,,,,,,,,,,,,,,,,,,,,,numbness and pain hands,,,,,,,,,,,,,,,,,,,difficulty movement hands,,,,,,,,,,,,,,,,,,,,,,
674,LacCaninum,,,,,,,,,,,,,,,,,,,,,,,,,,,,,,,,,,,,,,,,,,,,,,,,,,,,,,,,,,,,,,,,,,,,,,,,,,,,,,,,,,,,rheumatic pain s extermities back one side to other side,,,,,,,right side sciatica,,,,,,,pain arms to fingers,,,,burning palms and soles,,,,,,,,,,legs feel numb stiff,,,,cramps feet,,,,,,,,,,,,,,,,,,,,,,,,,,,,
675,Lachesis,,,,,,,,,,,,,,,,,,,,,,,,,,,,,,,,,,,,,,,,,,,,,,,,,,,,,,,,,,,,,,,,,,,,,,,,,,,,,,,,,,,,,,,,,,,sciatica right side better lying down,,,,,,,sensation thread from back to arms legs eyes etc,,,,,,,,,,,,,,pain tibia follow sore throat,,,,,,,,shotening tendons,,,,,,,,,,,,,,,,,,,,,,,,
676,Lacticum Acidum,,,,,,,,,,,,,,,,,,,,,,,,,,,,,,,,,,,,,,,,,,,,,,,,,,,,,,,,,,,,,,,,,,,,,,,,,,,,,,,,,,,,,,,limbs feel chilly,,,,,,,rheumatic pain in joints shoulders wrists knees with much weakness,,,,,,,,,,,,,,,,,,,,,,,,,,,,,,trembling whole body while walking,,,,,,,,,,,,,,,,,,,,
677,Lactuca Virosa,,,,,,,,,,,,,,,,,,,,,,,,,,,,,,,,,,,,,,,,,,,,,,,,,,,,,,,,,,,,,,,,,,,,,,,,,,,,,,,,,,,,,,,,,,,,,,,,,,,,,,,,,,,,,lame hip down left side worse walking,,,cramps shin tibia extend to toes o side leg involve calves,,,,coldness numbness feet legs,,,,,,,,,,,,,,,,,,,,,,,,,,,,
678,LappaArctium,,,,,,,,,,,,,,,,,,,,,,,,,,,,,,,,,,,,,,,,,,,,,,,,,,,,,,,,,,,,,,,,,,,,,,,,,,,,,,,,,,,,eruption on extermities,,,pain hands knees ankles extend downward to fingers toes,,,,,,,,,,,,,,,,,,,,,,,,,,,,,,,,pain in all joints,,,,,,,,,,,,,,,,,,,,,,,,,
679,Lathyrus,,,,,,,,,,,,,,,,,,,,,,,,,,,,,,,,,,,,,,,,,,,,,,,,,,,,,,,,,,,,,,,,,can not extend or cross legswhen sitting,,,,,,,,,,,,,,,,,,,,,,,mylitis with marked spastic symptoms,,,,,,,,,,,,,,,finger tips numb,,,,gluteal muscles lower limbs emaciated,,,,knees knock each other when walking,excessive rigidity legs blue swelling if hang down,calves muscles very tense,stiffness lameness ankle knees,heels do not touch floor,cramp legs worse cold and cold feet,toes do  not leave the floor,,,,,patient sits bent forward strighten up with difficulty,,tremulous tottering gait spastic,,,,rheumatic paralysis,,,,,,,,,,,,,,,,
680,Latrodectus Mactans,,,,,,,,,,,,,,,,,,,,,,,,,,,,,,,,,,,,,,,,,,,,,,,,,,,,,,,,,,,,,,,,,,,,,,,,,,,,,,,,,,,,,,,paraestesia lower limb,,,,,,,,,,pain left arm feels parlysed,,,,,,,,,,,,,,,weakness legs follow cramps in abdominal muscles,,,,,,,,,,,,,,,,,,,,,,,,,,,,,,,,
681,Laurocerasus,,,,,,,,,,,,,,,,,,,,,,,,,,,,,,,,,,,,,,,,,,,,,,,,,,,,,,,,,,,,,,,,,,,,,,,,,,,,,,,,,,,,,,,,,,veinf of hand distended,,,skin blue,,,,,,,,,,finger nails and toes becomes knotty clubbing,,,,,,sprained pains in hips thighs heels,,,cold calmy feet and legs,,,,,,,,,,,,,,,,,,,,,,,,,,,,,,,,
682,Lecithin,,,,,,,,,,,,,,,,,,,,,,,,,,,,,,,,,,,,,,,,,,,,,,,,,,,,,,,,,,,,,,,,,soreness aching lack energy tired weak,,,,,,,,,,,,,,,,,,,,,,,,,,,,,,,,,,,,,,,,,,,,,,,,,,,,,,,,,,,,,,,,,,,,,,,,,,,,,,,
683,Ledum,,,,,,,,,,,,,,,,,,,,,,,,,,,,,,,,,,,,,,,,gouty nodosities,,,,,,,,,,,,,,,,,,,,,,,,,pressure in shoulder worse motion,,,,,,,,,,,,,,,,,,,,,,rheumatism begins lower limbs and ascends,,,,,,,throbbing right shoulder,,,,,,,,,,,,,,,,,,,,ankle swelling easily spraining,,gouty pain shoot all through foot limbs joints esp small,ball of great toe swelling,soles painful can hardly step on them,crackling in joints worse warmth of bed,,,,,,,,,,,,,,,,,,,,,,,,,
684,Lilium Tigrinum,,,,,,,,,,,,,pain in back and spine trembling in front pressing down character,,,,,,,,,,,,,,,,,,,,,,,,,,,,,,,,,,,,,,,,,,,,,,,,,,,,,,,,,,,,,,,,,,,,,,,,,,,,,,,,,,,,,pain right arm and hip,,,,burning palms and soles,,pricking fingers,,,,,,,,leg aches pain can not keep them still,,pain ankle joint,,,,,,,,,,can not walk on uneven ground,,,,,,,,,,,,,,,,,,,,
685,Limulus,,,,,,,,,,,,,,,,,,,,,,,,,,,,,,,,,,,,,,,,,,,,,,,,,,,,,,,,,,,,,,,,,,,,,,,,,,,,,,,,,,,,,,,,,,,,,,,,,,,,,,,,,,,,,right hip joint pain,,,,,,heels sore ,,,soles of feet ache pain feel numb,,,,,,,,crural neurolgia,,,,,,,,,,,,,,,,,,
686,Lithium Carbonicum,,,,,,,,,,,,,,,,,,,,,,,,,,,,,,,,,,,,,,,,,,,,,,,,,,,,,,,,,,,,,,,,,,,,,,,,,,,,,,,,,,,,,,,,,,,,,,rheumatic pain through out shoulder joint arm finger joints and small joints,,,,,,,,,,swelling tenderness pain finger toe joints better hot water,,,,,,,pain in hollow foot extend to knee,,,ankles pain when walking,,,,,itching about nodular swelling in joints,,,,,,,,,paralytic stiffness all over,,,,,,,,,,,,,,,,
687,Lolium Temulentum,,,,,,,,,,,,,,,,,,,,,,,,,,,,,,,,,,,,,,,,,,,,,,,,,,,,,,,,,,,,,,,,,can not write hold glass water,,,,,,,,,,,,,,,,,,,loss power etermities cold extermities,,,trembling all limbs,,,,,,,,,,,spasmodic motions arm and legs,,,,,,,,,,,,,,,violent pain calves asif bound with cords,,,,,,,,,,,gait unsteady,,,,trembling hands in paralysis,,,,,,,,,,,,,,,,
688,Lonicera Xylosteum,,,,,,,,,,,,,,,,,,,,,,,,,,,,,,,,,,,,,,,,,,,,,,,,,,,,,,,,,,,,,,,,,jerking limbs trembling whole body,,,,,violent convulsion,,,,,,,,,,,,,,extermities cold sweating perspiration ,,,limbs and head fall over asif paralyzed,,,,,,,,,,,,,,,,,,,,,,,,,,,,,,,,,,,,,,,,,,,,,,,,,,,,,,,,,
689,Lycopodium,,,,,,,,,,,,,,,,,,,,,,,,,,,,,,,,,,,,numbness drawing  tearing limbs worse at rest night,,,,,,,,,,,,,,,,,,,,,,,,,,,,,twitching and jerking,,,,,,,,,,,,,,,,,,,foot right hot feft foot cold,,,limbs go to sleep ,,,,,,,tearing pain shoulder elbow joints,,,,heaviness arms,,,,,hands feet numb,,,,,sciatica worse right side,,,,,cramps calves toes at night in bed,,pain heel on treading as from pebble,one foot hot another cold profuse sweat feet,toes fingers contracted,painful calosities soles,chronic gout with chalky deposits in joints,,,can not lie on painful side,,,painful worse right side ,,,,,,,,,,,,,,,,,,,
690,Magnesia Carbonica,,,,,,,,,,,,,,,,,,,,,,,,,,,,,,,,,,,,,,,,,,,,,,,,,,,,,,,,,,,,,,,,,,,,,,,,,,,,,,,,,,,,,,,,,,,,,,tearing in shoulder asif dislocated,,,,,,,,,,,,,,,,,swelling in bends knee,,,,,,,,,,,whole body feels tired painfull esp legs feet,,,right shoulder painrull can rise,,,,,,,,,,,,,,,,,,,
691,Magnesia Muriaticum,,,,,,,,,,,,,,,,,,,,,,,,,,,,,,,,,,,,,arms go to sleep when waking morning,,,,,,,,,,,,,,,,,,,,,,,,,,,,,,,,,,,,,,,,,,,,,,,,,,,,,,,,,,,,,,,,,,,,,,,,pain back and hips ,,,pain arms and legs,,,,,,,,,,,,,,,,,,,,,,,,,,,,,,,,
692,Magnesia Phosphorica,,,,,,,,,,,,,,,,,,,,,,,,,,,,,,,,,,,,,,,,,,,,,,,,,,,,,,,,,,,,,,,,,,,,,,,,,,,,,,,,,,,,,,,,general muscular weakness,,,sciatica feet very tender pain,,,,,,,weakness arms hands finger tips stiff numb,,,writers players cramps,,involuntary shaking hands,,,,,,,,,,cramps calves  ,,,,,,,,,tetanic spasm,,twitching chorea,darting pains ,,,paralysis agitans impaired sensation,,,,,,,,,,,,,,,,
693,Magnesia Sulphurica,,,,,,,,,,,,,,,,,,,,,,,,,,,,,,,,,,,,,,,,,,,,,,,,,,,,,,,,,,,,,,,,,,,,,,,,,,,,,,,,,,,,,,,,,,,,,,,,,,left arm and foot fall asleep in bed in morning after walking,,,,,,,,,,,,,,,,,,,,,,,,,,,,,,,,,,,,,,,,,,,,,,
694,Magnolia Grandiflora,,,,,,,,,,,,,,,,,,,,,,,,,,,,,,,,,,,,,,,,,,,,,,,,,,,,,,,,,,,,,,,,,,,,,,,,,,,,,,,,,,,,,,,shooting in all limbs,,,,,,,,,rheumatic pain clavcles,,numbness left arm,,,,,,,,,,,,,,,,,,feet itch,,,,,,,,,stiff sharp erratic pain worse in joints,,,,,,,,,,,,,,,,,,,
695,Mancinella,,,,,,,,,,,,,,,,,,,,,,,,,,,,,,,,,,,,,,,,,,,,,,,,,,,,,,,,,,,,,,,,,,,,,,,,,,,,,,,,,,,,,,,,,,,,,,,,,,,,,,,icy coldness hands and feet,pain in thumb,,,,,,,,,,,,,,,,,,,,,,,,,,,,,,,,,,,,,,,,
696,Manganum Aceticum,,,,,,,,,,,,,,,,,,,,,,,,,,,,,,,,,,,,,,,,willsons disease,,,,,,,,,,,,,,,,,,,,,,,,,every part body feels sore to touch rheumatisms feet,,,,,walks stooping forward,,,,,,,,,,,,,,perioesteal inflamation,,,,muscular twitching,inflamation bone and joints  nightly digging pain,,,,supuration skin around joints,,,,,,,,,,,,,,intolerable pain in skin of lower limbs,,,,knees pain and itch,stiffness muscles of legs feel numb,cramps calves,ankle painful,,slap gait walk metacorpo phalangeal joint walks backward,,,shiny red swelling burning spots about joints,,,,,can not walk backwards with out fall tendency fall forward ,,,,paralysis agitans,,,,,,,,,,,,,,,,
697,Medorrhinum,,,,,,,,,,,,,pain back with burning heat,,,,,,,,,,,,,,,,,,,,,,,,,,,gouty concretions,,,,,,,,,,,,,,,,,,,,,,,,,,,,,,,,,,,,,,,,,,,,,,,,,,,,,,,,,,,,,,,restless better clutching hands,finger joints enlarged puffy,,,,,,,,legs heavy ache all night can not keep them still,,,heels balls feet tender pain,,,soreness soles,,,,burning hands and feet,,ankles easily turn when walking,,,,,,,,,,,,,,,,,,,,
698,Melilotus,,,,,,,,,,,,,,,,,,,,,,,,,,,,,,,,,,,,,,,,,,,,,,,,,,,,,,,,,,,,,,,,,,,,,,,,,,,,,,,,,,,,skin and extermities cold,,,,,,,,,,,,,,,,,,,,,,,,,,,pain knee wants stretch leg not relive better,,,,,,,,joints sore,,,numbness aching in knee joints,,,,,,,,,,,,,,,,,,,,,,
699,Menispermum,,,,,,,,,,,,,pain back thighs elbows shoulders legs sore asif bruised,,,,,,,,,,,,,,,,,,,,,,,,,,,,,,,,,,,,,,,,,,,,,,,,,,,,,,,,,,,,,,,,,,,,,,,,,,,,,,,,,,,,,,,,,,,,,,,,,,,,,,,,,,,,,,,,,,,,,,,,,,,,,,,,,,,
700,Menyanthes,,,,,,,,,,,,,,,,,,,,,,,,,,,,,,,,,,,,,,,,,,,,,,,,,,,,,,,,,,,,,,,,,,,,,,,,,,,,,,,,,,,,,,,,,,,,,,,,,,,,,,,icy coldness hand and feet,,,,,,,,,as soon as lies down legs jerk and twitch,,,,,,,,,,,,,cramp like pain,,,,,,,,,,,,,,,,,,,
701,Mercurius,,,,,,,,,,,,,,,,,,,,,,,,,,,,,,,,,,,,cold calmy sweat on legs at night,,,,,,,,,,,,,,,,,,,,,,,,,,,,,oily oily perspiration sweat,,,,,,,,,,,,,,,,,,,trembling extermities esp hands,,,weakness limbs,,bone pains and in limbs worse night,,,,,,,,,,,,,,,,,,,,,,,dropsicle swelling feet and leg,,,,,,,lacerating pain joints,,,patient sensitive to cold,,,,,,paralysis agitans,,,,,,,,,,,,,,,,
702,Mezereum,,,,,,,,,,,,,pain neck and back worse movement night,,,,,,,,,,,,,,,,,,,,,,,,,,,,,,,,,,,,,,,,,,,,,,,,,,,,,,,,,,,,,,,,,,,,,,,,,,,,,,,,,,,,,,,,,,,,,,,,pain hip and knee,,,pain burning tibia and long bones,,,,leg and feet go to sleep,,,,,,intolerant of all touch,,,,,,,,,,,,,,,,,,,,,,
703,Morphinum,,,,,,,,,,,,,,,,,,,,,,,,,,,,,,,,,,,,,,,,,,,,,,,,,,,,,,,,,,,,,,,,,,,,,,,,,,,,,,,,,,,,,,,,,,,,,,,,,,,,,,,,,,,,,,,,,,,,,,,,,,,,staggering gait numbness,,,,,,,,,,,,,,,,,,,,
704,Muriaticum Acidum,,,,,,,,,,,,,,,,,,,,,,,,,,,,,,,,,,,,,,,,,,,,,,,,,,,,,,,,,,,,,,,,,,,,,,,,,,,,,,,,,,,,,,,,,,,,,,,,,,,,,,,,,,,,,,,,,,,pain tendoachilles,,,,,,,heavy painful weakness,,tottering gait,,,,,,,,,,,,,,,,,,,,
705,Mygale Lassiodora,,,,,,,,,,,,,,,,,,,,,,,,,,,,,,,,,,,,,,,,,,,,,,,,,,,,,,,,,,,,,,,,,constant motion whole body tremulous,,,,,,,,,,,,,,,,,,,,,,limbs drag while walking,,,,,,intense red sreaks followcourse lymphatics,,,,,,,,,,,,,,,,,,,covulsive uncontrolable movements legs and arms,,,,,,,,,,,,unsteady gait,,,,,,,,,,,,,,,,,,,,
706,Myrica,,,,,,,,,,,,,,,,,,,,,,,,,,,,,,,,,,,,,,,,,,,,,,,,,,,,,,,,,,,,,,,,,,,,,,,,,,,,,,,,,,,,,,,,pain all muscles,,,,,,pain under shoulder blades and back of neck,,,,,,,,,,,,,,,,,,,,,,pain hollow right foot,,,,,,,,,,,,,,,,,,,,,,,,,,,,
707,Natrun Arsenicum,,,,,,,,,,,,,,,,,,,,,,,,,,,,,,,,,,,,,,,,,,,,,,,,,,,,,,,,,,,,,,,,,feel tired all over,,,,,,,,,,,,,,,,,,,,,,,,,,,,,,,,,aching arms worse in shoulder,,,,,,,,,,,,pain in thighs anterior crural nerves,knee joints crack,,,,,,,,joints stiff,,,,,,,,,,,,,,,,,,,,,,,,,
708,Natrum Carbonicum,,,,,,,,,,,,,,,,,,,,,,,,,,,,,,,,,,,,,great weakness limbs esp in morning,,,old sprains,,,,,,,,,,,,,,,,,,,,,,,,,,,,,,,,,,,,,,,,,,,,,,,,,,,,,,,,,,,,,,,chapped hands,soreness between toe and fingers,,,,,,,hollow of kneesis painful on movement,,,easy dislocation spraining ankles,heel and tendo achilles affected,foots bend under,,,,,,icy cold up to knees,,,,,,,,,,,,,,,,,,,,,,
709,Natrum Chloratum,,,,,,,,,,,,,,,,,,,,,,,,,,,,,,,,,,,,,,,,,,,,,,,,,,,,,,,,,,,,,,,,,,,,,,,,,,,,,,,,,,,,,,,,,,,,,,,,,,,,,,,hands swollen every morning,,,,,,,,extreem weakness in knees and ankles,,,,,,,,,,,,,,,,,,,,,,,,,,,,,,,,,
710,Natrum Muriaticum,,,,,,,,,,,,,pain back desire firm support,,,,,,,,,,,,,,,,,,,,,,,,,,,,,,,,,,,,,,,,,,,,,,,,,,,,every movement accelarates circulation,,,,,,,,,,,,,,,,,,,,,,,painful contraction hamstrings,,,,,,,,,,,,,,palms hot and perspire sweating,,,hanging nails dryness crackling about finger nails,,numbness tingling fingers lower extermities,,,,,arms legs esp knees feel weak,,ankles weak turn easily,,,,,crackling joints on movement motion,,,coldness leg with congestion head chest stomach,,,,,,,,,,,,,,,,,,,,,,
711,Natrum Phosphoricum,,,,,,,,,,,,,,,,,,,,,,,,,,,,,,,,,,,,,,,,rheumatic arthritis,,,,,,,,,,,,,,,,,,,,,,,,,,,,,,,,,,,,,,,,,,,,,,,,hamstring sore,,,,,,,,,,,,,weariness aching wrist finger joints,,,,,,,,,,rheumatism knee joint,,,,,,,,synovial cripitations,,,,,,,,,,,,,,,,,,,,,,,,,
712,Natrum Sulphuricum,,,,,,,,,,,,,,,,,,,,,,,,,,,,rheumatism worse damp cold weather,,,,,,,,,,,,gout,,,,,,,,,,,,,,,,,,,,,,,,,,,,,,,,,,,,,,,,,,,,,swelling axillary glands,,pain in limbs compels frequent changes in position run around,,,,,,,,,,,,,,,,,,inflamation around root of nails,,,,pain hip joints worse left stooping,,stiffness knee,,,,,oedema swelling feet,itching between toes,burning soles,crackling joints  ,,,,,,,,,,,,,,,,,,,,,,,,,
713,Niccolum Sulphuricum,,,,,,,,,,,,,,,,,,,,,,,,,,,,,,,,,,,,,,,,,,,,,,,,,,,,,,,,,,,,,,,,,,,,,,,,,,,,,,,,,,,,,,,,,,,,spine sore ,,,,,,,,,,,,,,,,,,,,spinal pains legs arms heavy weak can not lie on back,,,,,,awakened morning with burning soles,,,,stiff numb sensation worse in neck,,,,,,,,,,,,,,,,,,,,,,
714,Nitricum Acidum,,,,,,,,,,,,,,,,,,,,,,,,,,,,,,,,,,,,offensive sweat in axillae at night,,,,,,,,,,,,,,,,,,,,,,,,,,,,,,,,,,,,,,,,,,,,,,,,,,,,,,,,,,,,,,,,,,,sweat hands cold blue nails,,,,,,,,,,,,, fetid foot sweat cause soreness sticking pain chillblains toes ,,,,,,,,,,,,,,,,,,,,,,,,,,,,
715,Nux Moschata,,,,,,,,,,,,,,,,,,,,,,,,,,,,,rheumatism better by dry warm clothes,,,,,,,,,,,,,,,,,,,,,,,,,,,,,,,,,,,,fatigue on slightest exertion,,,,,,,,,,,,,,,,,,,,,,,,,,,,,,,,,,,,,,,,,,,,pain hip to knee worse movement motion esp going upstairs,,,,,,,rheumatism getting feet wet exposure draughts,,,,,,,,,,,,,,,,,,,,,,,,,,,,
716,Nux Vomica,,,,,,,,,,,,,,,,,,,,,,,,,,,,,,,,,,,,,sudden loss of power in arms legs morning,,,,,,,,,,,,,,,,,,,,,,,,,,,,,,,,,,,,,,,,,,,,,,,,,,,,,,,,,,,,,paresis arms with shocks,,,,,arms hands go to sleep,,,,,,,,crackling knee joints on during motion,legs numb feel paralyzed cramp calves soles,,,,,,,,,,,,drags feet when walking,,,,partial paralysis from over exertion or getting soaked,,,,,,,,,,,,,,,,
717,Oenanthe Crocata,,,,,,,,,,,,,,,,,,,,,,,,,,,,,,,,,,,,,,,,,,,,,,,,,,,,,,,,,,,,,,,,,convulsions opisthotonos,,,,,,,,,,,,,,,,,,,,,,,,,,,,,,,,,,,,,,numbness hand foot,,,,,pain along crural and sciatica nerve commencing from back,,,,,,,,cold hands and feet,,,,,,,,,,,,,,,,,,,,,,,,,,,,
718,Oleander Nerium Odorum,,,,,,,,,,,,,,,,,,,,,,,,,,,,,,,,,,,,,,,,,,,,,,,,,,,,,,,,,,,,,,,,,want animal heat in limbs,,,,,,,,,,,,,,,,,,,,,,,,,veins hands swelling oedema,,,,,,,,,,,,,,swelling burning stiffness fingers,,,weakness lower limbs,,,,,,,,,paralysis legs and feet,,,stiffness joints,,,constant cold feet,,,,,,,,,,,,,,,,,,,,,,
